sectionName,string
1. Introduction,"The combination of a red-edge, yellow, and two infrared bands of WV-2 provide additional valuable information for vegetation classification [16–18], which may be particularly useful when spectrally similar components like shrubs and trees need to be separated."
Discussion,"Action-based models of selective attention have done a good job of explaining interference effects associated with competing targets (Meegan and Tipper1998,1999) as well as negative priming (Tipper et al.2002) and IOR in a cue-target task (Briand et al.2000; Welsh and Elliott 2004b)."
,"Data from many groups also suggest that only the high-affinity receptor mediates the biologic response of the cells to GMCSF (3, 5, 7)."
Discussion and conclusions,"AMG was also afforded protection against CP-induced nephrotoxicity in rats (Mansour et al., 2002)."
Introduction,"When vascular invasion is identified in FTCs, there is a prognostic significance based on the number of vessels involved (< 4 or ≥ 4 vascular invasion)[7,11-15]."
Discussion,"Apoptosis can be distinguished from necrosis by its involvement of endonuclease activation leading to internucleosomal doublestranded chromatin (DNA) breaks and by the absence of the early cell membrane damage characteristic of necrosis (47, 48)."
Methods,"Class annotations were from Swiss-Prot [23,33]; some additional annotations were obtained from literature references for the recently described Nu [24] and Xi [25,26] classes."
Methods,"These were based on the WHO stepwise framework, (Epping-Jordan et al. 2005), and the prioritized research agenda for the prevention and control of NCDs (Mendis and Alwan 2011)."
3. Methods,"Most of these probably had an endobenthic lifestyle, because their morphology is similar to that of extant taxa under such conditions [Corliss, 1991; Buzas et al., 1993; Jorissen et al., 2007]."
4. Discussion,"Consistent with the results from a recent systematic review [10] of studies into the diagnostic accuracy of the 50-g GCT, the present study demonstrated that the"
Discussion,"HLA class II expression can be induced on cultured thyroid cells by the addition of IFN-gamma, but not by adding IFN-alpha or IL-2 without IFN-gamma (Todd et al., 1985)."
5 Perceptual justification,"In an attempt to quantify the preference of light source coming from above, Curran and Johnston [Curran and Johnston 1996] deployed a shape perception task as a function of the position of the light source."
Introduction,"The methylation of coding sequences does not seem to affect transcription, while the methylation of promoter sequences usually results in promoter inactivation (Sijen et al. 2001)."
Results,"…the absence of subsequent O1 delivery and S2 to predict the absence of subsequent O2 delivery; that is, stimuli trained in such manner exhibit properties (such as retardation) identical to those display by other conditioned inhibitors (Rescorla, 1969; Maier et al., 1976; Delamater et al., 2003)."
METHODS,"A 16S rDNA fragment was amplified by PCR (Hiraishi et al., 1994) using the universal primers 27F (59-AGAGTTTGATCATGGCTCGA-39; positions 8–27 in the Escherichia coli numbering system) and 1492R (59-GGCTACCTTGTTACGACTT-39; positions 1510–1492) (Weisburg et al., 1991)."
,"Addition of the calcium ionophore A23187, a compound known to increase the concentration of cytosolic Ca (Reed and Lardy 1972) decreased diosgenin production in T."
,"One important limitation of serum CA125 is that its levels are not elevated in 50% of women with stage I disease and up to 30% of patients with more advanced disease (Tuxen et al, 1995)."
3. METHODS,"For the assimilation of SMOS brightness temperature data, VIC is coupled with the Community Microwave Emission Model (CMEM) [3-5], which allows for simulating the Top Of the Atmosphere (TOA) brightness temperature contributions of the different surface covers at the hydrologic model resolution."
Results and Discussion,"have evolved via mutations targeted around their functional domains while the structural residues are constrained and maintain a highly conserved scaffold (Mackessy 2002; Kini 2004; Fry et al. 2006, 2008; Yamazaki and Morita 2007; Doley et al. 2008)."
6. Mitochondrial Lesions,"This influx of electrons into the mitochondrial matrix and the efflux of protons to the cytosol maintains mitochondrial membrane potential; however, it results in an increase in the production of ROS, RNS, and edema and makes the mitochondrial matrix an alkaline environment [21, 23, 33, 64, 100, 101, 107–116]."
Introduction,"The deep and superficial branches arise from the division of the radial nerve trunk, but the level of division related to the articular line space is not well-known [8, 29, 33]."
2.3 Funding costs and other BHC traits,"As argued by Demirgüç-Kunt and Huizinga (2004), Total cost of funds is an implicit interest rate on BHC liabilities, which is inferred from its financial statements."
4. Discussion,"Eastern rainbowfish exposed to low pH in hard and soft water displayed signs of increased respiratory stress at pH o5 (Holland et al., 2014a)."
Results,"After a wash in lowCa 2 Tyrode’s solution with ADVASEP-7 to remove any cell surface label, the amount of dye loss from the loaded vesicles was assessed by stimulating the endplates with 1 s trains of either 10 or 100 Hz, with 1 s alternating periods of rest, a pattern that approximates the way in which these junctions would be activated in vivo (Gorassini et al., 2000) (Fig."
INTRODUCTION,"The leader appears to promote transcription towards the repeats (Brouns et al., 2008; Hale et al., 2008; Lillestøl et al., 2006, 2009; Marraffini & Sontheimer, 2008), generating the RNAs that constitute the molecular base of the interference action (Brouns et al., 2008)."
,"Some have interpreted this as evidence for the “obligatory processing of all of the features of an object, even when instructions direct the observer to focus on only a single part” (Gauthier & Tarr, 2002)."
Discussion,This result is in agreement with previous studies working on carotenoid contents in macroalgae (Hanelt et al. 1997; Schofield et al. 1998; Harker et al. 1999).
DISCUSSION,"Acting via specific receptors, serotonin inhibits the activity of immune cells, including macrophages [14, 24]."
Introduction,"one stage of the life cycle may impact upon subsequent life history parameters (Post et al. 1997), whilst the inXuence of climate on multiple demographic parameters in the same species has rarely been studied in any taxon (Sillett et al."
Introduction,"During an infection with another alphaherpesvirus, HSV-1, in mice, it has been reported that CCL3 attracts NK cells [16], CCL2 recruits monocytes [17], and CCL5 recruits monocytes, NK cells, and PMNs [18] while CXCL9 recruits T-cells to the sites of infection [16, 19]."
"Ryan A. Flynna,1,2, Albert E. Almadaa,b,1, Jesse R. Zamudioa, and Phillip A. Sharpa,b,3","Moreover, divergent transcription, defined by detection of populations of low abundance small RNAs (19–25 nts) generated by nonoverlapping (separated by approximately 250 bps) bidirectional transcription, was detected at the majority of transcriptional start sites (TSSs) in mouse embryonic stem cells (mESCs) (5)."
,"which is exactly the cost function that leads to the nonlinear LPM-ICA algorithm (or particularly the LPM-ICA algorithm at the special case f ðrÞ 1⁄4 r) (Xu, Yang, & Amari, 1996; Xu, 1998b; Xu et al., 1998)."
4. RESULTS AND DISCUSSIONS,"To have different scales, 3000 texture samples each of 64x64, 128x128, 256x256, and 384x384 are randomly generated and resized to 256x256,[16]."
Discussion,"For example, although Vieira et al. (2006) listed most mites in mixed habitat associations, we found that 12 mite taxa showed clear pool versus riffle affinities, contributing to our knowledge of the habitat associations of this group. Similarly, 13 of the opposite discrepancies between our results and the Merritt et al. (2008) scheme were for Chironomidae taxa and a perusal of the Merritt et al. (2008) references for chironomid designations indicated that assignments were often based on considerations of general group"
,"For example, many studies found that there are decreasedMPFC and increased PCC functional connectivities in TLE.([13,14]) However, some researchers have found decreased DMN connectivities in PCC, anterior frontal, and parietal regions."
Results,"Therefore, one manifestation of the BRCA1–TONSL genetic interaction may well operate at sites of UV-induced damage, where both proteins are normally engaged in complex DNA damage responses (Duro et al. 2010; O’Connell et al. 2010; O’Donnell et al. 2010; Piwko et al. 2010; Pathania et al. 2011)."
2.2. Experimental design,"The OT dosage used in this study is 4 IU lower than the dose used in other studies demonstrating significant effects of OT on psychological variables (Kosfeld et al., 2005; Guastella et al., 2009; Ditzen et al., 2009)."
Reliability of Dot Probe Bias Scores,"Although themajority of studies have shown that dot probe bias scores have very low reliability, the results of Bar-Haim et al. (2010) and Enock et al. (2014) are promising in that they provide empirical evidence that dot probe scores can be somewhat more reliable in certain contexts."
Introduction,"Patients with PD and elderly fallers walk more slowly when asked to perform a cognitive task simultaneously, with a reduced swing time and with an increased stride variability (Bond and Morris 2000; O’Shea et al. 2002; Springer et al. 2006; Yogev et al. 2005)."
Methods,"Rainfall estimates (RFE) at 0.1 degree (about 10 x 11 km) resolution were obtained from the National Oceanic and Atmospheric Administration’s (NOAA) Climate Prediction Center (CPC) Famine Early Warning System (FEWS) Rainfall Estimates South Asia, version 2.0 (see; http://www.cpc.ncep.noaa.gov/products/fews/SASIA/rfe.shtml)."
Discussion,osmotic stress arising from irrigation with salt solutions contributed to observed patterns of plant mortality (Maas 1986).
3 Methods,"For the STN, we used the published data of Nakanishi et al. (1987), which have been previously used by Gillies and Willshaw (2004) to constrain a similar sigmoid function as per (6), which reproduces the firing properties of the STN neurons."
,Overexpression of AVP1 conferred drought- and salt-tolerance in the transgenic plants (Gaxiola et al. 2001; Park et al. 2005).
Introduction,"Furthermore, it has been shown that a minimum of 200–300 amino acids from the C-terminal of HrpZ from P. syringae pv. phaseolicola (HrpZPph) are required for the induction of HR (Lee et al. 2001a) implying that several functional domains exist in HrpZPph (Lee et al. 2001b)."
RESULTS AND DISCUSSION,"These data are different from those reported by Nir et al. (1994b), who showed a negative relationship between particle size and pH, as particle size decreased there was an increase in gastric pH."
2. Dialog Act Schema,"For example, while the ISO 24617-2 (Bunt et al., 2012) would tag ‘What?’ as AutoNegative thus capturing that the speaker is signaling non-understanding, we instead focus on what reaction the speaker expects to trigger in the listener by tagging this as a request to repeat."
1. Introduction,"Some of these configurations are: 3D simulated catalytic gauze, e.g., (Rinnemo et al., 1997), (Quiceno et al., 2006), 1D simulated catalytic foam, e.g., (Horn et al., 2007), (Dalle Nogare et al., 2011), (Korup et al., 2013), 3D simulated channel with catalytic walls, e.g., (Sa et al., 2010),…"
5.1 Experiments,"It is natural to study the swelling and shrinking of catalyzed bulk pNIPAm gels at first because of the relatively simple gelation process and the convenient methods of observation such as microscopy[78, 79]."
TG MICE AND DRUG TREATMENT PROTOCOL,"Cohorts of tg mice expressing mutated G37R-hSOD1 were bred and identified by genotyping of tail DNA as described (Martin et al., 2007, 2009; Wong and Martin, 2010)."
17.4 Collective Behaviours,"In another method loosely inspired from ants, Parunak et al. (2005) and Sauter et al. (2005) have robots search for targets by coordinating their actions through a map containing virtual chemicals (pheromone)."
4 Discussion,2005) and it is also considered a primary pathogen that can affect as much as 70% of the foliage of susceptible trees (Whyte et al. 2005).
3.1 Methodology,"In order to provide some reassurance about the validity and non-randomness of the obtained results, we present the results of statistical tests by following the approach proposed by Dem≈°ar [9]."
Introduction,"According to Cochrane Database of systematic Reviews, all of these three drugs are efficacious for mild to moderate AD (Birks 2006) though the symptomatic relief provided byAChE inhibition therapy is weak (Lleó et al. 2006) and fails to reverse disease progression (so-called disease-modifying effect)."
Present Address:,clutches of eggs and continues as crabs cycle through successive clutches (Hench et al. 2004; Forward et al. 2005).
Discussion,"Only two other studies have recorded such decreases following training, and these were of longer duration (12 24 weeks), consisted of less subjects (6 and 13) and conducted pre-HAART (MacArthur et al., 1993; Rigsby et al., 1992)."
Discussion,"Our results are not consistent with the taxonomic proposals of Klein (2004) and Delforge (2009), even with the former proposal of Tyteca and Klein (2008), although these authors (Tyteca and Klein 2009) accepted the enlarged genus Anacamptis sensu Bateman et al. (2003)."
1. Introduction,Safe-detection algorithms exploit onemain idea: a deadlock is an invariant property of the system [15].
RESULTS,"5E), a further indication that these cells can be considered M cells based on previous M-cell characterization studies (44)."
Discussion,"In our previous study, we found that RAG-mediated nicking and cleavage of oligonucleotide substrates containing cRSSs identified from lymphoid malignancies were either unchanged or slightly reduced in the presence of HMGB1 for most cRSSs tested (including LMO2, TAL1, Hox11, SIL, SCL), except Ttg-1 [24]."
Introduction,"…(germline mutations) of many of the individual HDACs occurred to be lethal, either during embryonic or very early postnatal development with deleterious effects on distinct tissues or cellular processes recognized as the proximal cause of death (Lagger et al., 2002; Haberland et al., 2009a,b)."
,"Contour-Induced Multiple Modulatory Effects in V1 and V2 Previous V1 studies have shown that global visual contours within a cluttered background induce two complementary modulatory effects (Chen et al., 2014; Gilad et al., 2013; Yan et al., 2014): enhancing responses of neurons with RFs lying on the contour (referred to as the contour facilitation) and suppressing neurons with RFs in the background (referred to as the background inhibition)."
Discussion,…in the time constant of fundamental phase VO2 “off-kinetics” at moderate vs. heavy exercise intensities (Krustrup et al. 2009; Ozyener et al. 2001; rossiter et al. 2002) whereas studies that measured EPOc magnitude and duration to the point at which resting metabolism was restored found that…
Introduction,"Environmental proteomics is beginning to reveal expressed functions within these communities (Ram et al., 2005) and to document functionally important strain variation (Lo et al., 2007; Denef et al., 2009; 2010b)."
DISCUSSION,"Measurement of central BP appears to offer advantages over brachial BP for risk stratification [4,6] and assessment of therapeutic efficacy [5]."
Methods,"Gene expression For quantification of mRNA expression in murine samples, cells/tissues were homogenized in TRIzol (Invitrogen), and RNA was extracted and cDNA was generated and quantified as previously described (91) using a Light Cycler 480 II (Roche)."
Evaluation,Preoperative radiographs were evaluated to determine the Paprosky score (18) and the American Academy of Orthopaedic Surgeons (AAOS) score (4) to classify the acetabular defects.
Results,"In alternans, Cai and Vm are coupled either positively (large Cai transient prolongs APD of the same beat) or negatively (large Cai transient shortens APD of the same beat) (Kennedy et al., 2017)."
2.5. Analytical methods,The number of functional groups was calculated from the integration ratios of the protons of the functional groups to the protons of the internal standard according to Pan et al. (2006b).
TKA,"Compared with the results of Bruy√®re et al., the results of the present study show similar scores for the WOMAC pain and stiffness subscales."
1.5 The Mystery of the Sushi Repeats: GABAB(1) Receptor Isoforms,"…locations (Benke et al. 1999; Billinton et al. 1999; Bischoff et al. 1999;
Chapter 1 33 _________________________________________________________________________________
Kaupmann et al. 1998b; Liang et al. 2000; Poorkhalkali et al. 2000; Princivalle et al. 2000;
Towers et al. 2000)."
3.2 Effect of Ramadan Fasting on Maternal Health,"They were performed in different countries (Gambia [24], Iraq [21], UK [25], Lebanon [26], Turkey [27,28,29,34], Iran [30,32,33,35], and UAE [31]) (Table 2)."
Results,"The ratio of mtDNA/NUMTs did not change with development from the base of the stalk to the leaf tip in dark-grown, light-grown, and dark-to-light-transferred seedlings, similar to our findings for maize ptDNA (Zheng et al. 2011)."
MATERIALS AND METHODS,Metacyclic trypomastigotes were obtained by incubating epimastigotes in triatomine artificial urine (TAU) medium as described previously (21).
6 Discussion,"The results are similar to two European studies that identified both selection and influence as significant in alcohol use similarities among adolescent friends [17,18]."
5 Generating function,which can be viewed as an apparently new property of the q-hyperbinary sequence (with q = z) studied in [1] and [14].
Syndromic surveillance,"The second system, the emergency department syndromic surveillance system (EDSSS), monitors the daily numbers of attendances in a network of sentinel emergency departments across England [17]."
METHODS,ALI risk factors before transfusion: Severity of illness was determined by calculating Acute Physiology and Chronic Health Evaluation (APACHE) III scores (24) before transfusion.
3. EXPERIMENTS,"Two methods (based on Local Binary Patterns), which were previously reported as competitive in automated diagnosis of CD [11] were utilized in addition to state-of-the-art global mid-level image representations which are obtained by pooling local image descriptors."
1. Introduction,The level of contamination and the chance of transmission of microorganisms imposed on paper currencies and coins are often associated with the economic status of a country and the levels of community hygiene [4].
3.1 Demand,"…from government and industry publications suggest that ongoing price reductions were not fully anticipated, even by industry insiders.26 Finally, Gillingham and Tsvetanov (2017) provide support for their assumption of static demand using data on purchases and a consumer survey in the…"
DISCUSSION,"As bigram frequency and memorability have been studied in existing works [23, 31], we focus on phrase sets with different word clarity (see Figure 4 and Figure 5)."
Introduction,"Data evaluating the effect of resident level on postoperative outcomes are limited and conflicting and have not been previously assessed in a pediatric patient population.(9,13) The purpose of this study was to determine if the postgraduate level of the intraoperatively involved resident correlates with operative outcomes for pediatric patients undergoing laparoscopic appendectomy for appendicitis."
1. Introduction,"In addition, [5] and [6] executed the researches about XACML, access control language which can be managed in XML documents."
3.2. Yield and characterisation of ethanol organosolv lignin (EOL),"These compounds have been shown to have potential as anti-carcinogens and anti-inflammatory agents (Pan et al., 2006b)."
Introduction,"…different disturbance regime attributes such as duration (Roxburgh et al. 2004), timing (Miller et al.
2012b), spatial and temporal autocorrelation (Elkin and Possingham 2008; Garrison et al. 2012), disturbance type, spatial extent, frequency, and severity (Shea et al. 2004; Miller et al. 2012a)."
,"Subsequent to IGF binding in colonocyte receptors, a number of actions may be prompted that favor tumor growth such as inhibition of apoptosis, promotion of cell proliferation, and angiogenesis [1, 7]."
4. Discussion,"In addition, previous evidence indicated that higher expression of SIRT1 upregulated antiapoptotic proteins Bcl-2 and Bcl-xl, downregulated proapoptotic protein Bax, then increases cell viability in ischemia-reperfused myocardium [15]."
Discussion,A common characteristic of HFpEF observed in our model is a reduction in cardiac reserve (Tan et al. 2009; Norman et al. 2011; Marshall et al. 2013).
Discussion,Similar mechanisms are found during neuronal subtype development in the Drosophila ventral nerve cord [17].
2. Methods,Free-field stimuli were simulated by filtering signals through head-related transfer functions (HRTFs) measured in one cat by Musicant et al. (1990).
1 Introduction,"Several papers have found that past subsidies significantly expanded demand for solar systems (Hughes and Podolefsky, 2015; Burr, 2016; De Groote and Verboven, 2016; Gillingham and Tsvetanov, 2017)."
Role of Holistic Thinking,"…without the express permission from Emerald Group Publishing Limited.
culturally dominant processing style (holistic or analytic thinking) (Nisbett et al., 2001), thinking styles can be viewed as a within-culture individual difference or can vary by the specific situation (e.g., Choi et…"
4. Discussion,"…carriage rate was 4.4%, which is in close agreement with that reported by Hisata et al. (2005), accounting for 2.3% more than the values mentioned in the study carried out by Torano et al. (2001) in La Habana, Cuba, 3.1% more than those of a study conducted in Brazil (Cardoso-Lamaro et al., 2009)."
Methods,"For power calculation in the linear regression analysis, we considered the magnitude of the gene-environment interaction, and according to Luan et al [50] an interaction was considered to be relevant in magnitude when the ratio of the two regression slopes [B1 for the genetic variable as additive in the first versus the second (B2) stratum was at least 2]."
