sectionName,string
Methods,The following murine mAb’s were used: 3BD10 (epitope TSHR amino acid residues 25–51) (27) and 2C11 (epitope containing amino acid residues 354–359) (29).
Theoretical implications,"Whites’ concern with in-group outcomes (i.e., White disadvantage) in organizations with race-based AAPs has received some scholarly attention (e.g., Lowery et al., 2006), yet how chronic race-related beliefs drive such concerns has largely escaped investigation."
DISCUSSION,"We have shown that renal AT1 and AT2 receptor binding correlates well with abundance of steady-state mRNA: as a result of 24 h of UUO in the neonatal rat, both AT1 and AT2 receptors are downregulated in the obstructed kidney (48)."
1. Introduction,"…al., 1997), have focused on representing specific tasks and domains, the attention has shifted to more general purpose schemas such as the Dialogue Act Markup using Several Layers (DAMSL) (Allen, 1997) and the ISO 24617-2(Bunt et al., 2010; Bunt et al., 2012), a standard for dialog act annotation."
DISCUSSION,"The presence of severe exacerbation in the previous year is a risk factor for mortality, which confirms the results from other studies (Almagro et al., 2002;Kim, Clark & Camargo, 2006; Piquet et al., 2013; Müllerova et al., 2015)."
Discussion,"Posterior putamen has previously been shown to be involved in habitual behavior [40,41,48], and the current result indicates that, following Pavlovian cues, more chronic AD patients activate habit pathways, which confirms the habit formation theory [5]."
METHODS,"To confirm some identities, and to compare splicing patterns between guinea pig and human, some groups were analyzed by BLAT analysis (with the human genome) [43] and visualization in EyeBrowse, an eyecentric version of the UCSC Genome Browser [44,45]."
Discussion,"Cigarette smoking has been previously shown to increase caffeine clearance [28,29] and affect the CBT results [14]."
,HT = medical treatment of moderate hypertension; CAB = coronary artery bypass; Hemodial = hemodialysis; L Transp = liver transplantation; HIV = medical treatment of human immune virus infections [8].
Discussion,"Other reasons for the low predictability of the Konishi equation could be the variation in nonrenal digoxin CL in different populations, reduced volume of distribution, and reduced myocardial sensitivity.(21) The results of our study cast doubt on the suitability of the Konishi equation for adjustment of drug dosage in clinical practice in Chinese patients, which could only be applied in stage 3 patients."
Murine mechanical ventilation,"Mice deficient in cd39 on the C57BL/ 6/129 svj strain or in cd73 on the BL6 stain were generated, validated, and characterized as described previously (15, 16)."
1 Introduction,"The response to a generated question will be supplied in the following conversations, which may be novel but not necessarily occur in the input as that in traditional QG (Du et al., 2017; Yuan et al., 2017; Tang et al., 2017; Wang et al., 2017; Mostafazadeh et al., 2016)."
Results and discussion,"92 and 12–35 mg/kg) in leafy green plants from Malaysia, Sri Lanka, China, Kathmandu, India and Turkey, respectively (Aweng et al. 2011; Kananke et al. 2014; Zhuang et al. 2009; Shakya and Khwaounjoo 2013; Yadav et al. 2013; Türkdoğan et al. 2002)."
Methods,Extracellular amplitude computation has been described in detail (Krans and Chapple 2005).
Memorability Metric,"Many researchers have highlighted the necessity of considering memorability when designing phrase sets [23, 25, 33, 39]."
Discussion,"…each of the three PIcoupled receptors on dopamine cells (mACh, mGluR, 1) is that the outward current induced by transient application of agonist was desensitized during the superfusion of a low concentration of agonist (Fiorillo and Williams, 1998; Paladini et al., 2001; Morikawa et al., 2003)."
Background,"conserved protein across bacterial phyla, and in some bacteria it is auto-regulated at the translational level [39]."
Introduction,"several members of A Disintegrin And Metalloproteinase (ADAM) family in thymic T cell development has been reported [7,8,9,10]."
Introduction,"Like HRR, ANHEJ also requires the processing of DSBs by MRE11 [22–25] and CtIP [18,26,27]."
Introduction,The mongooses (Herpestidae) are a small clade of 34 species that epitomize all these aspects of social variation (Rood 1986; Schneider and Kappeler 2014).
Introduction,"This, in turn, leads to reduction in the lumen-positive electrical potential in this nephron segment, resulting in increased urinary Mg2+ and Ca2+ (Riccardi & Brown, 2010)."
DISCUSSION,"…Actin to Protect Nuclei during Confined Migration and Promote Metastasis, Cell (2016), http://dx.doi.org/10.1016/j.cell.2016.10.023
The regulation and localization of actin nucleation factors are likely critical for specifying the function of actin structures in cells (Skau and Waterman 2015)."
DISCUSSION,These therapeutic options do not restore normal hyaline cartilage and have a short-term success rate [2].
1 INTRODUCTION,"For a KC model to be the basis for accurate modeling of knowledge growth, it must identify all KCs that contribute to the given overall skill, including ones that are not well-known or taught directly [18]."
Methods,"Third, PWM-20 is based entirely on the functional p53 REs (34 in vivo REs used for PWM-20 compared to 37 in vitro BSs used by Hoh et al. [64].)"
Discussion,"Stenosis of the stoma, one of the late complications, occurred in children with ileal conduit in up to 42% [5, 6, 7]."
Materials and Methods,"Group representative strains were screened for nifH, the gene encoding the nitrogenase iron protein dinitrogenase reductase , by dot blot hybridization using a biotinylated nifH specific DNA probe that detects a very wide range of diazotroph taxa Bagwell et al. 1998; 2001; Bergholz et al. 2001 ."
Discussion,"Instead of using the single fuzzless locus mutant developed mapping populations (Rong et al. 2005, 2007; Zhang et al. 2005; Guo et al. 2006; Wan et al. 2007), the common female parent line of the two F2 populations we developed combined at least two fuzzless loci (N1 and n2, and probably n3) (Turley and Kloth 2002)."
NATURE OF THE DEFICIT IN FEAR REGULATION IN THE POLYI:C OFFSPRING,"The present results using Long Evans rats are consistent with previous reports that MIA during pregnancy does not alter classical fear conditioning in the adult male offspring of either Wistar (Zuckerman and Weiner, 2005) or Sprague Dawley rat strains (Vorhees et al., 2012; Yee et al., 2012)."
Introduction,recently showed that the 242Tallele is associated with significantly lower basal and NADPH-stimulated vascular superoxide production in the blood vessels of patients with atherosclerosis [10].
DISCUSSION,"Thus far, increases in the diagnostic sensitivity of CA125 by using marker panels have been moderate (5–10%), often at the expense of decreases in specificity, and vice versa (Tuxen et al, 1995; Meyer and Rustin, 2000; Bast, 2003; Zhang et al, 2004)."
Methods,"For these samples, we applied a nested primer approach and used the additional primers: L15383* (Cibois and Pasquet 1999) and H15149* (Kocher et al. 1989)."
Methods,differences that might be expected on an additive scale of interaction as described by Hosmer and Lemoshow [46].
2. METHODOLOGY,"The title pages were, with slight modifications, the same as those used in the previous study by Svenonius and Molto (1990)."
1. Introduction,"This has subsequently been identified in
human cases of staphylococcal infection (Arias et al., 2008; Quinn et al., 2009; Toh et al., 2007), as well as in the LEADER Program for 2007 (Mendes et al., 2008)."
DISCUSSION,"On the other hand, in small-t-transfected CV-1 cells, the activation of MEK and MAP kinase by inhibition of PP2A was dependent on PI 3-kinase and PKC (53)."
INTRODUCTION,"Exposure to radiation especially at young ages is a risk factor in thyroid cancer [3], though in most cases, specific risk factors for DTC cannot be identified [4]."
METHODS,"In an attempt to standardize the bacteriologic procedures, all patients had a ‚Äúendocarditis diagnostic kit,‚Äù using an automate (Bactec Becton Dickinson, Sparus, Maryland) including standard BC and special samples for isolation of intracellular pathogens, and for various specific antibodies (7)."
Introduction,"However, Lo and Yeh [21] found that above protocols [18–20] cannot is vulnerable to the denial of proof attack."
Discussion,"Previous studies have also reported high expression levels of Cyclin B1 in a variety of cancers such as breast, cervical, gastric, coloectal, colon, and prostate cancers, as well as in myelogenous leukemia cells ([25-28])."
,"12 that outgroup dehumanization is conceptually and empirically distinct from outgroup prejudice, and also that it is uniquely associated with outgroup aggression (Kteily et al., 2015)."
Results,"Since starvation is thought to be one of the main dormancyinducing stresses encountered by Mtb inside the granuloma [11,33], Mtb WT and Dfcr mutants were starved in PBS to determine the role of the fcr genes in wax synthesis under this dormancy-inducing stress."
2. METHODS,A thorough evaluation of the PPDF and computation of its moments can be obtained via Markov Chain Monte Carlo (MCMC) methods [3].
DISCUSSION,Our zebra finch results seem somewhat in between those obtained by Nagel et al. (2010) and those of van der Aa et al. (2015) for the discrimination between two stimuli of which the temporal parameters were varied compared to the training stimuli.
Methods,The false discovery rate (FDR) of identification was calculated to be less than 1% as described [30].
Results and discussion,"According to previous works, it is well-known that different solvent combinations can be employed for the separation and analysis of cannabinoids in HPLC-MS/MS [35, 36]."
,"Although the distribution of the two collagen types is widely overlapping, important differences have been described, including a high ratio of type VI to type I collagen in intervertebral disks and articular cartilage, and an opposite proportion in bone and a preferred localization of type VI collagen in the pericellular space or underneath epithelial cell layers (Keene et al., 1988; Marvulli et al., 1996)."
Discussion,"Our findings are supported by a growing number of epidemiological studies showing an association between air pollution exposure and cognitive impairment in the elderly (Chen and Schwartz 2009; Power et al. 2011; Ranft et al. 2009; Wellenius et al. 2012; Weuve et al. 2012a; Chang et al. 2014; Tonne et al. 2014, Ailshire and Crimmings 2014, Ailshire and Clarke 2014) and by toxicological studies suggesting that air pollution has neuropathological effects (Block and Calderón-Garcidueñas"
Introduction,"The sano locus encodes a putative cytoplasmic protein of 778 aa, which is related to the Themis gene family (Chung et al., 2009; Johnson et al., 2009)."
Background,"In fact, naive subjects are not able to distinguish real from synthetic stimuli (Turing test) (Ezzat et al. 2002)."
INTRODUCTION,"Concerning heavy metals tolerance and accumulation in plants, many genes involved in adaptive tolerance and detoxification of HMs have been identified and isolated from several plants (Verbruggen et al., 2009; Krämer, 2010; Ueno et al., 2011; Luo et al., 2016)."
INTRODUCTION,", 2002; Voinnet, 2009), with a subset of them also repressing translation (Aukerman and Sakai, 2003; Brodersen et al., 2008; Chen, 2004; Dugas and Bartel, 2008; Gandikota et al., 2007; Lanet et al., 2009)."
Discussion,"comparisons of the current results of TMS effects received from the tactile unimodal WM task with the previous findings of TMS effects received from a tactile-visual cross-modal WM task (Ku et al., 2015), the authors believe that it is a reasonable assumption that the"
Discussion,"…study, it is
documented that body weight, clinical signs and micronucleus appearance did not differ in Vit E+Setreated broiler chicks when compared with the control group (Sharaf et al., 2009) which is also an indication that this amalgamation can assuage the noxious effects of CY more effectively."
4. Discussion,"Interestingly, it plays only an inferior role in the NHFS([9]) and is not included in the POSSUM system.([12]) In summary, given the importance of cognitive ability, assessing cognitive ability must become part of the clinical routine."
3. Discussion,"These results agree with the model proposed by Walker et al. [13], and then
 confirmed by other Authors [17‚Äì19], which describes the granule formation during spray drying."
Introduction,"Therefore, we tested three morphine-like drugs that represent a range of efficacy: morphine (intermediate efficacy), buprenorphine (relatively low efficacy), and etorphine (relatively high efficacy) (Emmerson et al. 1996; Selley et al. 1998) on the hot-plate and tail-flick tests under conditions previously described (Paronis and Holtzman 1991; Kalinichev et al."
4. Discussion,"Similar results presented in [12], suggest that attention must be paid to the beam size and divergence, in order to avoid redundancy on the data caused by overlapping when measuring in high resolution at reduced distances."
3 Experiments,"Throughput-sensitive flows were represented by TCP flows carrying a delay hint of 80 ms. Delay-sensitive flows were represented by TFRC [3] flows carrying a delay hint of 32 ms.
 Analyzing throughput and delay alone is not sufficient as application performance realistically involves tradeoffs between throughput and delay."
6 Experiments,"We used the fully-connected model, F1, as well as shallow convolutional models C1 and C3 suggested by Keskar et al. (2017). As a demonstration of more current architectures, we used the models: VGG (Simonyan, 2014) and Resnet44 (He et al."
Results,"Based on the knowledge that NSP1 binds in vitro to all eleven viral mRNAs [4, 15] and the suggestion that it may interact with other viral proteins [13], we hypothesized that such interactions could affect the susceptibility of NSP1 to be degraded."
Results and Discussion,"Gln105 of human NQO1 is an
especially important residue for catalytic activity (Chen et al., 2000)."
1. Introduction,"[11] have examined textile electrodes properties, comparing them with standard Ag-AgCl electrodes using evaluation of human surface ECG."
DISCUSSION,"[8,11] In general, patients with straight sinus thrombosis present with acute headache, nausea, vomiting, seizures, altered mental status, focal neurologic deficits, coma, and/or death because of venous infarction of the bilateral thalami and basal ganglia.[6] Typical MRI findings are high signal intensity and swelling of the bilateral thalami, internal capsules, and basal ganglia on T2WI and FLAIR."
,"A similar trend exists for thyroid cancer, as the diagnosis of small and indolent tumors has steadily risen.(8,9)"
Introduction,"…with several action-based models of selective action that suggest turning one’s visual attention to an object or location in space may be the same process as preparing a movement to that object/location (e.g., Rizzolatti et al.1994; Tipper et al.1992; Welsh and Elliott 2004b; Welsh et al.1999)."
INTRODUCTION,"The functionality of both genes and their expression during mineralization of 2,4-D and 3-CB has been confirmed (Kasberg et al., 1995; Laemmli et al., 2000, 2004; Pérez-Pantoja et al., 2000; Plumeier et al., 2002)."
1.1. Related work,"Most of them, referred as background subtraction approaches, assume that the input video is captured by a stationary camera and model background colors at each pixel location using either generative [18, 15] or nonparametric [14, 5] methods."
Discussion,"…a significant role in the gait of elderly fallers and patients with PD (Blin et al. 1990; Hausdorff et al. 1998, 2001; Hausdorff 2005; Schaafsma et al. 2003; Springer et al. 2006; Yogev et al. 2005), leading one to speculate that a close association exists between gait variability and asymmetry."
DISCUSSION,"Mir-185 was initially reported to be upregulated in rapidly progressing IPF [12] but in later studies, miR-185 downregulation was demonstrated in IPF lungs, compared to controls [15, 16]."
1. Introduction,"One of the most promising methods among them is PLDA (Kenny, 2010; Prince and Elder, 2007)."
Discussion,"Our results for regulation of PR protein expression are consistent with other reports, which demonstrate cyclic changes in PR proteins in human (52, 53) and rat (18, 50) Fallopian tubes as well as human (39, 43, 75) and rat (27) uteri."
2.1 Endothelial cell studies,"injection of 150 mL volume as described previously.(28,29) This dose of IL-17 was chosen based on previous reports and represents a medium to high level of serum IL-17 as seen in patients with inflammation."
INTRODUCTION,"Studies have demonstrated that intermittent hypoxia (IH) is the key pathophysiological character of OSA [2, 3]."
Introduction,"…the expansion of artificial structures in coastal waters might be an important driver of the increase in Aurelia spp. populations due to the resultant increase in the availability of suitable benthic habitats for polyp proliferation (Duarte et al., 2012; Purcell, 2012; Makabe et al., 2014)."
"Targeting Senile Endothelium, Brain Biometal (Fe, Ca) Dyshomeostasis, and GlucoseTransport/BBB Disruption","…factors (e.g., hypertension, stroke, and diabetes) (Arvanitakis et al. 2016; Bogush et al. 2017; Eskildsen et al. 2017; Kelleher and Soiza 2013; Longden et al. 2016; Love and Miners 2017; McInerney et al. 2017; Nielsen et al. 2017; Perrotta et al. 2016; Sheen and Sheu 2016; Sudduth et al. 2017)."
,"lengths was interpreted to indicate a progressive thickening of the layer with continued cooling [e.g., Hansen and Willis, 1998; Ghent and Hansen, 1999; Hansen et al., 2000]."
1. Introduction,"An MP system is an MP grammar equipped with a temporal interval τ , a conventional mole size ν, and substances masses, which specify the time and population (discrete) granularities, respectively [19]."
3.1 Growth rates,"…P aper |
D iscussion P aper
| D iscussion P aper |
As a cold water species (Winter et al., 1994), with a biogeography spanning the Arctic and sub-polar Northern Hemisphere (McIntyre and Bé, 1967; McIntyre et al., 1970), C. pelagicus could potentially dominate calcite production in this region."
Discussion,"This finding is new for the Thr-Glu-Tyr motif and is consistent with the reported phosphorylation of Tyr during AR induced by LPC (de Lamirande et al., 1998, de Lamirande and Gagnon, 2002) and A23187 (Aitken et al., 1995)."
DISCUSSION,"Although fast growing woody plants have been widely used for cleaning up HM contaminated soils, limited information is available about the physiological and molecular mechanisms of HM tolerance and detoxification in woody plants (Konlechner et al., 2013; Luo et al., 2016)."
3.1. Depression,"…open studies, all of the open studies investigating the cognitive effects of rTMS in depression stimulated the left DLPFC via high frequency rTMS (Triggs et al., 1999; Martis et al., 2003; Fabre et al., 2004; O’Connor et al., 2005; Kuroda et al., 2006; Bloch et al., 2008; Vanderhasselt et al.,…"
METHODS,"For DNA methylation studies, nucleosomes first were extracted from prefrontal cortex gray matter and then immunoprecipitated with two anti-methyl-histone specific antibodies [anti-histone H3tri-methyl-lysine 4 (H3K4me3) and anti-H3-tri-methyl-lysine 27 (H3K27me3)] to separate open chromatin at sites of actual or potential transcription from repressive and silenced chromatin, exactly as described [17,18]."
Introduction,", 2004), improve carcass characteristics (Swingle et al., 1979; Matulis et al., 1987; Cranwell et al., 1996a; Stelzleni et al., 2007) and meat quality (Cranwell et al."
2 Methods,"Slant column NO2 is retrieved using a DOAS linear least squares fit (Platt and Stutz, 2008; Wenig et al., 2005) as in the operational DOAS retrievals (Boersma et al., 2007;10 Bucsela et al., 2006)."
3.2. SURFACE AIR TEMPERATURE,"The excessive model precipitation over the mountainous west tends to result in excessively wet soils in summer, which cause high latent heat flux, low sensible heat flux, and surface cooling (Bonan, 1998)."
Discussion,"Boron has been suggested to act as a chemical modulator of phenolic synthesis so that in the absence of B, phenolics are produced in excess (Lee and Aronoff 1967; Dugger 1983)."
Discussion,"This situation is even more obvious if this prevalence is compared with that for age-matched populations, and it is in concert with the results of a casecontrol study that failed to establish a significant relationship between the occurrence of gallstones and GERD [29]."
,The UB-Tree [20] integrates a space filling curve and a BTree creating a primary index for multidimensional data.
Methods,"Following selective amplification, PCR products were purified using Sephadex G-75 gel filtration columns (Porath and Flodin 1959)."
4. Discussion,[1] reported that 17% of women using the LNG-IUS for contraception experienced a period of at least 90 days of no B/S during the first year.
3. Gaussian mixture and Gaussian mixture-of-experts,"Particularly, when A‘ ¼ 0 it reduces into the normalized RBF nets (Moody & Darken, 1989; Nowlan, 1990; Xu, 1998a; Xu et al., 1994)."
Introduction,"Two distinct chromatin-remodeling complexes of the Swi2/Snf2 family - the RSC and SWI/SNF chromatin remodeling complexes - are implicated in the regulation of histone gene transcription [22,23]."
DATA ANALYSIS,This final step in the regression analysis was included to examine the possibility that environmental risk might moderate the persistence of maternal depressive symptomatology across the three time-points.([19])
INTRODUCTION,"In recent years, an understanding of the mechanisms of GFb signal transduction has provided insights into the unction of TGFb signals in developing embryos (reviewed n Whitman, 1998)."
Discussion,These findings unlike that of Craik et al. (1996) show that retrieval processes can be disrupted under conditions of divided attention.
4. Experiments,"Through experiments, the performances of RSNets are compared with various state-of-the-art 3D segmentation methods including 3D volumes based methods [20], spectral CNN based method [24], and point clouds based methods [13, 15, 10]."
Experimental Birds and Diets,"The cultured AF (50 mg AFB1/kg) was produced using Aspergillus parasiticus (NRRL 2999) on ground corn at University of Missouri as described by Gowda et al. (2008). Six premixes, contributing 4."
2 State of the Art,"Similarly, recent work by Balcan, Beygelzimer and Langford [2] provides an upper bound on label-complexity of Õ(d2 log 1 ) for learning half-spaces under the uniform, in a certain agnostic scenario, via an intractable algorithm."
DISCUSSION,"[5,6,13,14] The abdominal superficial venous dominance is one of the most extended and accepted (but not proved) hypothesis for explaining the diffuse congestion as a large diameter SIEV may denote dominance over the deep venous system.[6] Blondeel et al."
Introduction,"Both ADAM10 and ADAM17 are believed to influence T cell development via their activity as sheddases for Notch receptor and Notch ligands [8,9,10]."
Introduction,Lemurs provide an interesting case for evaluating the predictions of this hypothesis because they possess many anatomical and behavioral traits thought to have evolved for exactly this purpose: energy conservation and risk minimization (Wright 1999; Jolly 1966).
3. EXPERIMENTAL RESULTS,"For evaluating the performance of our method, we used six comparative methods: the method using only visual features and applying MvLFDA to these visual features (C1), the method concatenating multiple visual features to one long vector and applying LPCCA to EEG features and the long vector (C2), and the methods applying LPCCA to EEG features and each visual feature and integrating multiple EEG-based visual features via simply concatenating them to one long vector (C3), MSE [18] (C4), Supervised MSE (SMSE) [21] (C5), and Multi-view Discriminant Analysis (MvDA) [32] (C6), where C2 and C3 applied LFDA to the long vector after concatenating multiple features."
,Average part interpretability of filters in CNNs for singlecategory classification using the Pascal VOC Part dataset [3].
Experiments,"At last, we apply RMR and G-RMR on the application of human head pose estimation (Sherrah and Gong, 2001)."
5.3 Uncertain FTLE and LCS Visualization,"In our previous study [2], we generalized FTLE and LCS to analyze uncertain unsteady flows based on SFMs."
1. Introduction,"some GST polymorphisms are thought to alter cancer susceptibility in mammals (Hayes and Pulford, 1995)."
5. Goal Recognition with Markov Logic Networks,"Drawing upon previous goal recognition research, (Blaylock and Allen 2003; Mott et al. 2006), the work presented in this chapter defines goal recognition as the task of predicting the most likely goal for a given sequence of observed low-level player behavior in the game environment."
DISCUSSION,"These reports are consistent with SdpI regulating dynamin-driven fission of endocytotic and transport vesicles from their donor membranes (15, 17, 18, 20)."
2 Semi-Supervised Learning for Crowd Workers,"These two steps are the same as in the original algorithm [25], which has its orientation in spectral clustering [14]."
METHODOLOGY,"All the items in the questionnaire were adopted from the validated measurement tools which had been used in Skyrme and Amidon (1997a), Chase (1997), Chong et al. (2000) and KPMG Consulting (1998, 1999) studies."
